{
  "schema_version": "1.0",
  "id": "kv.tone.stoplist",
  "type": "tone_stoplist",
  "verified": true,
  "locale": "ru",
  "terminology": "pandora_box",
  "notes": "DRAFT (chat 2.2, LT1). verified:false -> held in kv-pending, NOT in the live pack (loadPack would refuse). Ivan reviews/edits, flips verified:true, then this moves to content-packs/kv/tone.stoplist.json (sidecar, loaded by evals/orchestrator by path, not via content[]). Machine gate: tone_stoplist.schema.json + the evals lt1gate test. SEVERITY discipline (arch sec 2.3 targets phrase-cliches, not single words): unambiguous pastiche phrases + explicit canon markers (e.g. воистину) -> block; ambiguous normal single words (e.g. избранный) -> warn or remove. Final severity per term is Ivan's call (docs/LT1_TONE_REVIEW.md); the severity field below is a prepared default.",
  "payload": {
    "entries": [
      { "term": "древнее зло пробуждается", "reason": "Middle-earth pastiche; the single highest slop-risk line", "severity": "block" },
      { "term": "тьма сгущается", "reason": "genre cliche; abstract menace instead of a concrete percept", "severity": "block" },
      { "term": "тьма грядёт", "reason": "genre cliche; portentous abstraction", "severity": "block" },
      { "term": "силы тьмы", "reason": "flattens specific adversaries into a generic mass", "severity": "block" },
      { "term": "судьба мира", "reason": "epic-stakes inflation; the solo scope is personal, not world-ending", "severity": "block" },
      { "term": "эпическая битва", "reason": "out-of-register scale word", "severity": "block" },
      { "term": "пророчество гласит", "reason": "prophecy framing; not the TOR register", "severity": "block" },
      { "term": "избранный", "reason": "chosen-one trope; AMBIGUOUS single word -> warn (Ivan finalizes or removes in review)", "severity": "warn" },
      { "term": "воистину", "reason": "mock-archaic tic; pastiche of an archaic voice", "severity": "block" },
      { "term": "века и века", "reason": "vague time-inflation filler", "severity": "block" }
    ]
  }
}
